id,pregunta,respuesta;;;
"1,O que é e como visualizar o vale-compra?,""O vale-compra é a opcao de troca, onde o total pago pelo produto devolvido, fica disponivel para voce realizar uma nova compra.""";;;
"2,Como funciona a Politica de troca e devolucao?,""Voce pode solicitar a troca ou devolucao do produto em ate 7 dias corridos, a partir da data do recebimento do seu pedido. A troca pode ser pelo mesmo modelo do item, ou por um vale compras para utilizar em um item de sua prefer√™ncia.""";;;
3,Como faço para rastrear meu pedido?,Voce pode acompanhar o seu pedido pelo nosso aplicativo ou site.;;;
"4,Qual o prazo de aprovação do pedido?,""O prazo para a aprovação do pedido, depende da forma de pagamento escolhida no momento da compra.""";;;
"5,Como faço para imprimir o boleto?,""Assim que você finaliza o pedido, a gente envia o boleto por e-mail. Por lá, você pode fazer o download para imprimir.""";;;
"6,Como conseguir a segunda via da nota fiscal do meu pedido?,""Se voce precisa da segunda via da notal fiscal do pedido, deve seguir os passos: Acesse o site e faça o login"; Clique em ‚ÄúMeus pedidos‚Äù e depois em ‚ÄúVer detalhes‚Äù; Na linha do tempo do seu pedido, a op√ß√£o ‚ÄúSua nota fiscal foi emitida. Aqui est√° ela‚Äù, estar√° dispon√≠vel;" Clique no link para fazer o download do arquivo."""
"7,""Preciso alterar meu e-mail ou senha, o que faço?"", Você pode alterar seus dados pelo nosso site.";;;